Job Title,Company,Location,Expiry Date,Description
Call for Independent Consultants,N/A,Harare,Expires 13 Aug 2025,"We are a Zimbabwe-based consulting firm dedicated to driving sustainable development by leveraging homegrown expertise. We believe that Africa's most pressing challenges are best solved by skilled, local professionals who understand the context and are committed to making a difference. We are currently building a database of experienced individual consultants"
AGRONOMY GRADUATE TRAINEE,Green Fuel,Chipinge,Expires 13 Aug 2025,Applications are invited from suitably qualified individuals to fill the above vacancy that has arisen in the Agronomy Department. The successful applicants will undergo a 2-year intensive training under the supervision of the Agronomist whilst performing any other duties as assigned.
Property Sales Agent,N/A,Harare,Expires 13 Aug 2025,"We are recruiting on behalf of our client for a professional, driven, and customer-focused Property Sales Agent who is passionate about real estate and thrives in a client-facing role. This position is perfect for someone who enjoys building relationships, showcasing properties, and closing deals. You'll be responsible for actively promoting"
INVITATION TO TENDER: SUPPLY AND INSTALLATION OF CHEMISTRY & PHYSICS LABORATORY BLOCK,World Vision,Harare,Expires 13 Aug 2025,"World Vision Registration No. PVO 26 /79 INVITATION TO TENDER: SUPPLY AND INSTALLATION OF CHEMISTRY & PHYSICS LABORATORY BLOCK World Vision invites tenders from reputable and experienced organizations for the supply and installation of a Chemistry and Physics laboratory block (1x2 rooms, each accommodating 30 learners) at Gogo Secondary School,"
CEDIS Project business case and success story documentation,Mercy Corps,Mutare,Expires 13 Aug 2025,"Project/Consultancy Title: CEDIS Project business case and success story documentation Project Location(s): Bulawayo, Mutare, Harare Project: With funding from the Embassy of Sweden, Mercy Corps is implementing the Catalysing Economic Development through the Informal Sector (CEDIS) program. The 4-year programme aims to improve incomes, working conditions and resilience to shocks"
TERMS OF REFERENCE FOR LOCALISING THE CHILD & YOUTH SAFEGUARDING(CYS) POLICY.,SOS Children's Villages Zimbabwe,Harare,Expires 12 Aug 2025,"TERMS OF REFERENCE FOR LOCALISING THE CHILD & YOUTH SAFEGUARDING(CYS) POLICY. Background of the Organisation 1 Context Established in 1949, SOS Children's Villages International is a dynamic, international social development organization working globally to meet the needs and protect the interests and rights of children without parental care and those"
Chemistry-Sciences Teacher,N/A,Harare,Expires 11 Aug 2025,Position: Chemistry-Sciences Teacher Location: Harare We are seeking a dynamic and passionate Chemistry-Sciences Teacher to join our team and inspire our Cambridge syllabus candidates. The ideal candidate will instill confidence in learners and foster a love for science.
"Attach Loans Officer (Chipinge, Chimanimani)",Symdunes Financial Services,Chimanimani,Expires 11 Aug 2025,"The Attach Loan officer will evaluate, authorize approval or deny loan applications for people or for business, act as liaison between customers and our financial institution and help qualified applicants acquire loans in a timely manner. The Attach Loans Officer will report to the Senior Loans Officer."
"Attach Loans Officer (Chipinge, Chimanimani)",Symdunes Financial Services,Chimanimani,Expires 11 Aug 2025,"The Attach Loan officer will evaluate, authorize approval or deny loan applications for people or for business, act as liaison between customers and our financial institution and help qualified applicants acquire loans in a timely manner. The Attach Loans Officer will report to the Senior Loans Officer."
Adult Literacy Teacher - ICT,The Halo Trust,Mashonaland Central,Expires 11 Aug 2025,"The ICT Teacher will deliver foundational digital literacy training to adult learners in remote or underserved communities, focusing on practical, context-relevant ICT skills aligned with the ECDL / ICDL (International Computer Driving Licence) curriculum and HEXCO standards. The Teacher will foster digital inclusion by empowering learners with essential computer competencies"
Office Administrator : RockHound Bricks,N/A,Harare,Expires 10 Aug 2025,WE'RE Hiring! OPEN POSITION Office Administrator Gender: Female
Sales and Marketing Officer,N/A,Harare,Expires 10 Aug 2025,We are looking for a Sales and marketing officer
Instrumentation and Calibration Engineer,The Biotech Institute,Harare,Expires 10 Aug 2025,"We are seeking a resourceful Instrumentation & Calibration Engineer to manage, maintain and calibrate the Institute's portfolio of laboratory and process instruments. The successful candidate will keep our asset register current, carry out scheduled maintenance and validations, and ensure full compliance with ISO/IEC 17025. The role shall also support the"
Front Desk Receptionist,N/A,Harare,Expires 10 Aug 2025,A small startup is looking for a Front desk receptionist
Accounts Clerk,N/A,Harare,Expires 10 Aug 2025,We are Hiring OPEN POSITION; Accounts Clerk
General Manager,Raysun Capital,Harare,Expires 10 Aug 2025,"Raysun Capital is seeking an experienced and results-driven General Manager to lead the day-to-day operations, drive growth, and optimize performance across its financial services portfolio. The ideal candidate will have a strong background in microfinance or SME lending, a data-driven approach to decision-making, and a proven ability to lead high-performing"
AFTERCARE OFFICER ( 2 Posts),ZIDA,Harare,Expires 10 Aug 2025,"PURPOSE: Assists investors with post-establishment facilitation and support for investment retention expansion, and development of linkages between domestic and foreign investors to support the Agency's strategy."
Sales Representative,N/A,Harare,Expires 10 Aug 2025,"On behalf of our client, we are recruiting for the position of Sales Representative. We are seeking a driven and results-oriented individual to join their team. The successful candidate will be responsible for identifying potential clients, making cold calls, following up on leads, conducting client meetings, preparing proposals, and delivering"
Human Resources Supervisor,Isteel and Pump Solutions,Harare,Expires 10 Aug 2025,We are looking for a human resources supervisor to lead the human resources department.
A-Level Biology & Chemistry Teachers,N/A,Harare,Expires 10 Aug 2025,Are you a passionate educator with a strong background in science? Join our vibrant team at a leading institution in Harare dedicated to academic excellence and holistic development. Positions Available: Advanced Level Biology Teacher Advanced Level Chemistry Teacher
Front Desk Receptionist,N/A,Harare,Expires 10 Aug 2025,A small startup is looking for a Front desk receptionist
Instrumentation and Calibration Engineer,The Biotech Institute,Harare,Expires 10 Aug 2025,"We are seeking a resourceful Instrumentation & Calibration Engineer to manage, maintain and calibrate the Institute's portfolio of laboratory and process instruments. The successful candidate will keep our asset register current, carry out scheduled maintenance and validations, and ensure full compliance with ISO/IEC 17025. The role shall also support the"
Accounts Clerk,N/A,Harare,Expires 10 Aug 2025,We are Hiring OPEN POSITION; Accounts Clerk
Registered General Nurse,Gransharp Enterprises (Pvt) Ltd,Kwekwe,Expires 09 Aug 2025,We are seeking a dedicated and compassionate Registered General Nurse to join our healthcare team. The ideal candidate will provide high-quality nursing care to patients in compliance with established medical protocols.
PRIMARY CARE NURSE X 1,Green Fuel,Chipinge,Expires 09 Aug 2025,"To support the SHE operations by attending to emergencies of employees, accompany patients to hospital, assisting the nursing staff and any other duties as assigned."
Senior Lecturer/Associate Professor/Professor in Accounting and Finance,Africa University - AU,Mutare,Expires 08 Aug 2025,"Reporting to the HOD, the incumbent will serve as an Accounting and Finance Lecturer and will be teaching and conducting solution-oriented research that will lead to policy change, commercialisation, and industrialisation in line with the Education 5.0."
Biker / Courier,N/A,Harare,Expires 08 Aug 2025,"We're hiring experienced and enthusiastic bikers to join our delivery team. As a courier, you'll be responsible for transporting packages, to various locations in a timely and safe manner. This is a great opportunity for people who enjoy being outdoors and staying active while working."
Senior Lecturer/Associate Professor/Professor in Accounting and Finance,Africa University - AU,Mutare,Expires 08 Aug 2025,"Reporting to the HOD, the incumbent will serve as an Accounting and Finance Lecturer and will be teaching and conducting solution-oriented research that will lead to policy change, commercialisation, and industrialisation in line with the Education 5.0."
DISPATCH TANK OPERATOR X 1,Green Fuel,Chipinge,Expires 08 Aug 2025,Dispatch Tank Operator takes ethanol storage tanks stock daily and loads the road tankers with ordered ethanol volumes according to the marketing requirements.
Vice Chancellor's Personal Assistant,Africa University - AU,Mutare,Expires 08 Aug 2025,"VICE CHANCELLOR'S PERSONAL ASSISTANT Reporting to the Vice Chancellor, the Personal Assistant provides high-level administrative and operational support to the Vice-Chancellor whose activities are multi-dimensional, extremely complex and externally visible, and are paramount to the success, reputation and integrity of the University."
SALES AND MARKETING GRADUATE TRAINEE,TOTAL NETWORKS,Bulawayo,Expires 08 Aug 2025,Train under experienced manager to:  Effectively sell the company's products and/or related services.  securing orders from existing and prospective customers through a relationship-based approach.  Explain products and services to existing/potential customers and assists them in selecting those best suited to their needs.
Class 3 and 4 Driver,Midlands State University MSU,Gweru,Expires 08 Aug 2025,Applications are invited from suitably qualified and experienced persons for the following post: NATIONAL PATHOLOGY RESEARCH AND DIAGNOSTIC CENTRE Post A: CLASS 3 AND 4 DRIVER (1 Post)
Head Of Supply Chain,N/A,Harare,Expires 08 Aug 2025,"We are seeking a vibrant and dynamic individual to join our team. Reporting to the Chief Executive Officer, the successful applicant will, among other key duties, be responsible for effectively and efficiently sourcing goods and services whilst managing the business relationship with established suppliers to support the strategic and operational"
COMPLIANCE OFFICER,EmpowerBank Limited,Harare,Expires 08 Aug 2025,An exciting opportunity for a Compliance Officer has arisen within our Compliance department. Suitable and qualified candidates are encouraged to apply. The successful candidate shall be responsible for ensuring that all bank operations conform with governing laws and regulations.
Night Nursing Manager,The Avenues Clinic,Harare,Expires 08 Aug 2025,"We are hiring NIGHT NURSING MANAGER We are seeking a qualified and experienced Night Nursing Manager to oversee hospital operations, ensure quality patient care, and manage clinical and nursing teams during night shifts."
Charge Sister,The Avenues Clinic,Harare,Expires 08 Aug 2025,We are hiring We are seeking an experienced Registered General Nurse with a post-basic specialty qualification to lead clinical and operational activities in our wards.
ADVISOR- PROGRAM QUALITY LEARNING AND ACCOUNTABILITY,ActionAid Zimbabwe,Harare,Expires 08 Aug 2025,LOCATION : HARARE
ADVISOR- PROGRAM QUALITY LEARNING AND ACCOUNTABILITY,ActionAid Zimbabwe,Harare,Expires 08 Aug 2025,LOCATION : HARARE
Trainee Section Manager (6),Hippo Valley,Harare,Expires 08 Aug 2025,"Job Title: Trainee Section Manager (6) Job Level: Cl Operations/ Location: Hippo Valley Estates (3) / Triangle Limited (3) Reports To: Section Manager Purpose of Role: 24 months contract where incumbent is trained formally and, on the job, to manage a section."
Supply Chain Attachee,Fidelity Life Assurance,Harare,Expires 08 Aug 2025,We are inviting applications for a student attachment opportunity in our Supply Chain department. This role is ideal for students currently pursuing a degree in Supply Chain Management or a related field. The successful candidate will gain hands-on experience and practical exposure in a dynamic work environment.
Apprenticeship Intake 2026,Hippo Valley,Chiredzi,Expires 08 Aug 2025,"APPRENTICESHIP INTAKE 2026 Tongaat Hulett is an agricultural and agri-processing business which includes integrated components of land management and property development. Through its sugar operations, Tongaat Hulett emphasizes on renewable energy, with biofuel production and electricity generation becoming increasingly important to the business. The current focus is on leveraging the"
Graduate Trainees - Sales,Panmart,Manicaland,Expires 08 Aug 2025,"Are you a recent graduate ready to kickstart your career in sales? We are looking for dynamic, self-motivated, and ambitious individuals to join our Graduate Trainee Program in Sales"
FINANCE INTERN,Adult RApe Clinic,Harare,Expires 08 Aug 2025,Applications are invited from candidates for internship as a Finance Intern. The Adult Rape Clinic (ARC) is a Registered Non-Governmental Organization that offers medical and psychosocial support care to survivors of sexual gender-based violence (SGBV). ARC is looking for a Finance Intern to be based in Harare. ARC's employment policy
IT Student On Attachment Wanted,WebZim,Harare,Expires 08 Aug 2025,Webzim is looking for an IT Student on Attachment. The ideal candidate must be studying towards a degree in IT or related degree. Location: Harare.
Agronomy Attachees x 2,N/A,Harare,Expires 08 Aug 2025,"AGRONOMY ATTACHEES X2 We are looking for students on attachment to be placed in our organisation, providing an opportunity to gain practical experience relevant to their field of study."
Communications Intern,Adult RApe Clinic,Harare,Expires 08 Aug 2025,Applications are invited from candidates for internship as a Communications Intern. The Adult Rape Clinic (ARC) is a Registered Non-Governmental Organization that offers medical and psychosocial support care to survivors of sexual gender-based violence (SGBV). ARC is looking for a Communications Intern to be based in Harare. ARC's employment policy
COMPLIANCE OFFICER,EmpowerBank Limited,Harare,Expires 08 Aug 2025,An exciting opportunity for a Compliance Officer has arisen within our Compliance department. Suitable and qualified candidates are encouraged to apply. The successful candidate shall be responsible for ensuring that all bank operations conform with governing laws and regulations.
