Job Title,Company,Location,Expiry Date,Description
INVITATION FOR EXPRESSION OF INTEREST FOR A CONSULTANT TO DEVELOP VIRAL HEPATITIS B AND C GUIDELINES,"Zimbabwe Technical Assistance, Training and Education Center for Health (Zim-TTECH)",Harare,Expires 20 Dec 2025,"Title: Consultant for Developing Viral Hepatitis B and C Guidelines Duration: Three months Deadline for Receipt of Expressions: 19 December 2024 Background The Ministry of Health and Child Care (MOHCC) in Zimbabwe is seeking a qualified consultant to develop comprehensive guidelines for the prevention, testing, treatment, and care of Viral"
Instore Counter Sales Reps,N/A,Harare,Expires 18 Dec 2025,"Description A fast growing company in the motor spares distribution and retail business is seeking the services of Instore Counter sales reps to be based in Harare, Mutare, Gweru, Chivhu and Bulawayo"
Marketing Officer,The Customer Experience Association of Zimbabwe (CXAZ),Harare,Expires 15 Dec 2025,WE ARE LOOKING FOR A MARKETING OFFICER TO JOIN OUR VIBRANT TEAM IN HARARE Description The incumbent will be reporting to the Sales and Marketing Manager.
Socio-Economic Strengthening Officer,Family AIDS Caring Trust - FACT,Makoni,Expires 15 Dec 2025,"FACT Zimbabwe is a Christian based organisation that was instituted in 1987. Since establishment, FACT Zimbabwe has been a leading national HIV and development organisation implementing various projects directly and through partnerships. The organization have since grown to become a broad-based health and development organization whilst maintaining special focus on"
Service Providers and Suppliers Registration,Corporate 24 Hospital Group,Harare,Expires 13 Dec 2025,"Applications are invited from interested, reputable and prospective suppliers of goods and services to register as approved suppliers and service providers for the year 2025 for Corporate 24 Hospital along J.Tongogara Street between 8th and 9th Avenue Bulawayo. Suppliers will be required for the following product and service categories:"
INVITATION TO TENDER TENDER FOR CONSULTANCY FOR PRIVATE SECTOR & FINANCIAL INSTITUTION ENGAGEMENT AND BEST PROJECT SCALE PROPOSAL DEVELOPMENT,World Vision,Harare,Expires 13 Dec 2025,World Vision Registration No. PVO 26 /79 INVITATION TO TENDER TENDER FOR CONSULTANCY FOR PRIVATE SECTOR & FINANCIAL INSTITUTION ENGAGEMENT AND BEST PROJECT SCALE PROPOSAL DEVELOPMENT World Vision Zimbabwe (WVZ) is inviting reputable individuals/organizations to submit bids for consultancy services to support the Resource Development and Donor Engagement (RDDE) in
Expression of Interest :  Invitation for Partnership,Trcaire,Harare,Expires 11 Dec 2025,"Expression of Interest Invitation for Partnership Trcaire has been supporting projects in Zimbabwe since the 1970's. Informed by our global strategy, our current country programme works in 4 main areas: 1) Supporting Women and Girls' Protection, Voice, and Leadership, 2) Climate and Environmental Justice 3) Active Citizenship and Access to"
Nurse Counsellor - Cimas Ruwa Clinic,CIMAS,Harare,Expires 09 Dec 2025,"Job Summary Cimas Health Group's purpose is to inspire healthier communities by providing global standard health and wellness solutions. In pursuant to this purpose, Cimas is searching for a Nurse Counsellor to join the organization and provide nursing services to patients in line with Cimas policies, procedures and professional standards."
Marketing Interns,Munch Zimbabwe,Harare,Expires 08 Dec 2025,Munch Zimbabwe is looking for marketing interns
Bikers,Munch Zimbabwe,Harare,Expires 07 Dec 2025,Munch Zimbabwe for bikers with own bikes
Injection Mold  Operator,N/A,Harare,Expires 06 Dec 2025,"INJECTION MOLD OPERATOR REPORTS TO PRODUCTION SUPERVISOR JOB SUMMARY A manufacturing organization is looking to engage a qualified and experienced person. The position requires an individual with experience in the plastics manufacturing industry. As the organization has aggressive expansion plans, we require a high calibre, proven experience in running plastic"
CALL FOR EXPRESSION OF INTEREST FOR CONSULTANCY SERVICES FOR THE DESIGN AND IMPLEMENTATION OF A CAPACITY DEVELOPMENT PROGRAM FOR SIMUKAI CHILD PROTECTION PROGRAMME,Simukai Child Protection Program,Harare,Expires 05 Dec 2025,"Simukai Child Protection Programme (PVO27/12) (http://www.simukaicpp.org.zw)is a multi-service Organization that provides a range of child and youth-based programs for the community. It was established to serve children and youths in a holistic and inclusive manner based on the Eco-systemic child rights approach. The Organization also empowers children, young people and"
"DENTAL NURSE (Sponsored Trainee), AVENUES + BORROWDALE BASED",DOMBOSHAVA MEDCLINIC,Harare,Expires 02 Nov 2025,"1. Digital Proficiency: Strong command of internet essentials, proven secretarial skills, and demonstrated computer literacy are required. 2. Front Office and Public Relations: Responsible for reception duties and maintaining a professional public image for the organisation. 3. Stakeholder Communication: Handle communication with external partners, clients, and stakeholders in a courteous"
Receptionist,N/A,Harare,Expires 08 Sep 2025,An excellent oppoturnity for a young and vibrant professional to work in an awesome and collaboratibve environement supporting the team with top of the class client services support!
HOUSE MAID,Hammer and Tongues Africa Holdings,Harare,Expires 05 Sep 2025,"Cleaning, Washing and Preparing meals"
Sales Representative,N/A,Harare,Expires 04 Sep 2025,"On behalf of our client, we are recruiting for the position of Sales Representative. We are seeking a driven and results-oriented individual to join their team. The successful candidate will be responsible for identifying potential clients, making cold calls, following up on leads, conducting client meetings, preparing proposals, and delivering"
DENTAL & MEDICAL SURGERY ASSISTANT/NURSE AIDE ATTACHEE,DOMBOSHAVA MEDCLINIC,Harare,Expires 31 Aug 2025,This is not a position for chancers. Only those who comply with minimum listed requirements can apply. What is a dental surgery assistant? This is a trainee position not a job offer. During and after training your responsibilities may include preparing patients and the operating room for the dentist. You
Group Managing Director,N/A,Harare,Expires 31 Aug 2025,Group Managing Director
Group Project Management Administrator,N/A,Harare,Expires 31 Aug 2025,Group Project Management Administrator
BURSAR,ZIMCARE TRUST,Harare,Expires 31 Aug 2025,"The Bursar is responsible for professional handling of all finances at the centre, submitting returns and preparing all books for both internal and external audit."
Procurement and logistics officer,Plus Five Pharmaceuticals,Bulawayo,Expires 31 Aug 2025,"As a Procurement And Logistics Officer, you will be responsible for managing the procurement of raw materials, supplies, and equipment, as well as coordinating logistics and supply chain operations to ensure timely and efficient delivery of products. This is an urgent requirement, and the successful candidate will be expected to"
BURSAR,ZIMCARE TRUST,Harare,Expires 31 Aug 2025,"The Bursar is responsible for professional handling of all finances at the centre, submitting returns and preparing all books for both internal and external audit."
SENIOR NURSE AIDE (PA/Secretary) to NURSING MATRON,DOMBOSHAVA MEDCLINIC,Harare,Expires 31 Aug 2025,1. Internet essentials 2. Reception duties 3. Communication with external stakeholders 4. Hospital secretarial duties 5. Minute taking 6. Assist the Midwife as a senior nurse aide 7. Assist the dentist during clinical work. 8. AODs as directed by Matron This is not a position for chancers. Only those who
INTERNS- SALES AND MARKETING / SUPPLY CHAIN MANAGEMENT,Nash Paints,Harare,Expires 30 Aug 2025,Nash Paints is looking for Sales and Marketing/ Supply Chain Management Attachees to join their organization.
Telesales Representative - Pharmaceutical and Beauty Care Products,Plus Five Pharmaceuticals,Harare,Expires 30 Aug 2025,"As a Telesales Representative, you will be responsible for selling our range of pharmaceutical and beauty care products to our target market via telephone. You will build relationships with customers, identify new sales opportunities, and achieve sales targets."
Till Operators and Shop Assistants,Southsea Investments Pvt Ltd,Harare,Expires 30 Aug 2025,"Are you passionate about retail and looking for a rewarding career? We are a leading retail company committed to excellence, customer satisfaction, and employee growth. We are currently hiring for multiple positions across various departments. If you have the skills, experience, and enthusiasm to thrive in a fast-paced retail environment,"
Van sales representatives,Plus Five Pharmaceuticals,Harare,Expires 30 Aug 2025,"A leading distributor of pharmaceutical and beauty care products in Zimbabwe. We are seeking a skilled and experienced Van Sales Representative to join our team and drive sales growth to supermarkets, pharmacies, and shops in Harare and the surrounding provinces. As a Van Sales Representative, you will be responsible for"
Web & Graphic Designer,N/A,Harare,Expires 30 Aug 2025,"We are looking for a talented individual who not only has a strong aesthetic sense but also possesses robust technical skills in website development, specifically with WordPress and Elementor. This role is perfect for a self-motivated learner who is passionate about creating seamless and engaging digital experiences. You will be"
INTENSIVE AND CORONARY CARE NURSE X1 ZVISHAVANE,Cell Insurance Group,Zvishavane,Expires 29 Aug 2025,Description Applications are invited from suitably qualified and experienced candidates to fill the position of RGN-Intensive and Coronary Care Nurse that has arisen at Nectacare Private Limited in Zvishavane.
NURSE ANAESTHETIST X1 - ZVISHAVANE,Cell Insurance Group,Zvishavane,Expires 29 Aug 2025,Applications are invited from suitably qualified and experienced candidates to fill the position of RGN-Anaesthetist that has arisen at Nectacare Private Limited in Zvishavane.
Primary School Teacher,N/A,Bindura,Expires 29 Aug 2025,"Our school seeks a qualified and dedicated Primary School Teacher to join our academic staff for the Third term 2025. The successful candidates will be responsible for delivering high-quality instruction in all core subjects, fostering a positive and productive learning environment, and assessing student progress effectively. We are looking for"
INTENSIVE AND CORONARY CARE NURSE X1 ZVISHAVANE,Cell Insurance Group,Zvishavane,Expires 29 Aug 2025,Description Applications are invited from suitably qualified and experienced candidates to fill the position of RGN-Intensive and Coronary Care Nurse that has arisen at Nectacare Private Limited in Zvishavane.
Sales and Marketing Officer,N/A,Harare,Expires 28 Aug 2025,"We are recruiting on behalf of our client for a dynamic and results-driven Sales & Marketing Officer. This is an exciting opportunity for a mature and experienced individual who is passionate about sales and marketing, and eager to drive business growth through client acquisition, brand visibility, and market development in"
SALES REPRESENTATIVE,N/A,Harare,Expires 26 Aug 2025,"We are seeking a young, energetic, and enthusiastic Sales Representative aged between 19 and 21 years, who is quick to learn and confident in speaking to clients. The ideal candidate should possess strictly O' and A' Level qualifications and be passionate about sales, customer service, and building long-term client relationships."
Sales &Marketing Representative,Wovenstars,Harare,Expires 25 Aug 2025,"Applications are invited from suitably qualified and experienced persons to fill in the position of a Sales and Marketing Representative responsible for building and maintaining customer relationships, tracking sales data and producing performance reports."
Attach Digital Marketing Officer (Rusape),Symdunes Financial Services,Rusape,Expires 24 Aug 2025,"The Attach Digital Marketing Officer will be responsible for creating and executing digital marketing campaigns that increase brand awareness, generate leads, and convert passive audiences to active customers as well as identifying and pursuing business opportunities. The Attach Digital Marketing Officer will report to the Marketing Officer."
Sales and Marketing Attachment,N/A,Mutare,Expires 24 Aug 2025,Persons wanted for Sales and marketing attachment position in Mutare and must be 18 years and above.
Casual Driver Class 2,N/A,Harare,Expires 24 Aug 2025,Persons wanted for casual/driver and must be 18 years and above
Driver,PELUM (Participatory Ecological Land Use Management Association),Harare,Expires 23 Aug 2025,"Position:Driver Location:Harare, with frequent travel to various districts Type:Full-time, 1-year contract (renewable based on performance) Reports to:Finance and Administration Officer Organizational Background Participatory Ecological Land Use Management (PELUM) Zimbabwe is a programme of the Zimbabwe Institute of Permaculture (ZIP), structured as a network of primarily civil society organizations working to"
INVITATION TO EXPRESS INTEREST,PELUM (Participatory Ecological Land Use Management Association),Harare,Expires 22 Aug 2025,"SUBJECT: OPEN CALL FOR EXPRESSIONS OF INTEREST FOR CONSTRUCTION OF OFFICE SUPERSTRUCTURE. PELUM Zimbabwe is inviting qualified and experienced construction companies to submit Expressions of Interest (EOI) for the construction of the superstructure of its new office building, located in Mt. Hampden. Scope of Work"
Farm Production Managers X2,Green Feathers Farm Pvt Ltd,Wedza or Hwedza,Expires 22 Aug 2025,"We are a diversified agricultural business located in the heart of Wedza district, just 120 km southeast of Harare. Our main pillars of production are horticulture, cereals & tobacco, livestock and agro tourism. Are you passionate about agriculture, innovation, and making a positive impact? We are seeking talented and experienced"
Security Guards,N/A,Harare,Expires 20 Aug 2025,"We are conducting an explosive mass recruitment drive for a minimum of 100 experienced, mature, and highly disciplined proffessional Security Guards to be deployed at a strategic mining environment between Chegutu, Kwekwe Mt Darwin and Harare Regions. This is a serious, high-demand opportunity suited for professionals ready to serve with"
Finance Manager - Property Division,N/A,Harare,Expires 20 Aug 2025,FINANCE MANAGER - PROPERTY DEVELOPMENT DIVISION JOB SUMMARY Overall Management of the Finance Function for the Real Estate Division
Reservation Manager (Manor House),Traverze Travel,Harare,Expires 20 Aug 2025,"As the Reservation Manager, you will oversee all bookings and reservations at The Manor House, ensuring a seamless guest experience from inquiry to arrival. Your role is central to optimizing occupancy, maintaining guest satisfaction, and supporting front-of-house efficiency."
General Manager - Auctioneering Division,N/A,Harare,Expires 20 Aug 2025,ANONYMOUS JOB ADVERTISEMENT 1. GENERAL MANAGER - AUCTIONEERING DIVISION JOB SUMMARY Overall Management of Auction Business
Sales and Marketing Intern,High Performance Lubes,Harare,Expires 19 Aug 2025,High Performance Lubricants is inviting applications for Sales and Marketing Intern positions to actively promote our products and brand. The student will be given an opportunity to develop practical skills and gain real world experiences in the Sales and Marketing field.
Localisation Consultancy for the Zimbabwe Environmental Law Association (ZELA),Zimbabwe Environmental Law Association (ZELA),Harare,Expires 18 Aug 2025,"The Zimbabwe Environmental Law Association (ZELA) is a public interest environmental law organisation promoting environmental justice, sustainable and equitable use of natural resources, and good governance. With a rights-based approach rooted in Environmental, Economic, Social, and Cultural Rights (EESCR), ZELA works extensively with grassroots communities, including through its community monitors,"
General Hand,SOS Children's Villages Zimbabwe,Bindura,Expires 18 Aug 2025,"GENERAL HAND SOS HERMANN GMEINER SECONDARY SCHOOL BINDURA (Job Ref: HGSS/04/08/25) Position title:  General Hand Working location: SOS Hermann Gmeiner Secondary School. Context of the position Established in 1949, SOS Children's Villages International (CVI) is a dynamic, international social development organization working globally to meet the needs and protect"
NATIONAL AND EXPORT MARKET FEASIBILITY STUDY CONSULTANCY,Nyahunure Community Organisation,Murehwa,Expires 18 Aug 2025,TERMS OF REFERENCE FOR NATIONAL AND EXPORT MARKET FEASIBILITY STUDY Nyahunure Community Organisation (NCO) and Christian Aid are looking for a consultant to conduct a 15-day National and Export Market Feasibility Study designed to enhance export market opportunities for smallholder women farmer groups in the Mashonaland East production corridor. This
Assistant House Parent,SOS Children's Villages Zimbabwe,Bindura,Expires 18 Aug 2025,"About Established in 1949, SOS Children's Villages International (CVI) is a dynamic, international social development organization working globally to meet the needs and protect the interests and rights of children without parental care and those who are at the risk of losing it. SOS Children's Villages Association of Zimbabwe is"
Resource Development & New Business Development (NBD) Manager - Zimbabwe,Save the Children International,Harare,Expires 17 Aug 2025,"RESOURCE DEVELOPMENT AND NEW BUSINESS DEVELOPMENT MANAGER ROLE PURPOSE: The Resource Development & New Business Development (NBD) Manager - Zimbabwe is a pivotal role in supporting Save the Children Zimbabwe and the wider Malawi-Zimbabwe Cluster to anticipate, adapt, and respond to the changing development and humanitarian funding landscape. This role"
Van Salesman - Manicaland Province,Panmart,Mutare,Expires 17 Aug 2025,We are looking for an experienced and self-driven Van Salesman to join our growing team in Manicaland. The successful candidate will be responsible for selling and distributing our range of fast-moving dry groceries to various retail outlets and customers across the province.
Scarp Yard Clients Manager,N/A,Harare,Expires 17 Aug 2025,"Location: Harare, Zimbabwe Position Type: Full-Time We are seeking a motivated and results-driven Scrap Yard Clients Manager to join our team in Harare. The ideal candidate must be confident in sales, cold calling, and client engagement-especially within the scrap metal sector."
Operations Manager - Clinical Laboratory,Parrogate Zimbabwe (PVT) Ltd,Harare,Expires 16 Aug 2025,"An exciting opportunity awaits for an experienced Laboratory Operations Manager for a Clinical Laboratory Company to join their highly professional health care team. The Operations Manager oversees the end-to-end administrative and logistical functions of the clinical laboratory. This role ensures optimal workflow, staff efficiency, service delivery, and regulatory compliance. The"
Headmaster,N/A,Harare,Expires 16 Aug 2025,"We are recruiting on behalf of our client a dynamic, principled, and visionary headmaster to lead our school into its next chapter of excellence. This is a unique opportunity for a leader who is passionate about education, committed to holistic development, incapable of fostering a culture of integrity, innovation, and"
Chief Executive Officer (CEO): Solid Capital Investments,N/A,Harare,Expires 15 Aug 2025,Job Title: Chief Executive Officer (CEO) Location: Harare Company: Solid Capital Investments Zimbabwe (Pvt) Limited Application Deadline: 21 July 2025 About the Company Solid Capital Investments Zimbabwe (Pvt) Limited is a licensed and rapidly growing microfinance institution committed to providing inclusive financial services that empower individuals and small businesses. Our
Inter-Company Liaison Officer,N/A,Harare,Expires 15 Aug 2025,Inter-Company Liaison Officer
Marketing Officer (Infinite Bloom),Traverze Travel,Harare,Expires 15 Aug 2025,"We are a vibrant and growing floral business specializing in fresh cut flowers (Infinite Bloom), floral arrangements, and event floral dcor. Our mission is to bring beauty, creativity, and joy into every space with flowers. We are currently seeking a dynamic and creative Marketing Officer to join our team and"
Student Attachees x 2 : Survey and & Geoinformatics,N/A,Harare,Expires 15 Aug 2025,"Applications are invited from undergraduate students in the department of Survey &Geoinformatics to fill in vacances that have arisen immediately. We are a Land Development company based in , Harare The students will be expected to perform various survey duties in the Survey department as part of their development."
Student Attachee,NATIONAL EMPLOYMENT COUNCIL FOR THE CATERING INDUSTRY IN ZIMBABWE,Harare,Expires 15 Aug 2025,STUDENT ON ATTACHMENT
Accounts Officer Debtors,Allied Timbers Zimbabwe (Pvt) Ltd,Harare,Expires 15 Aug 2025,"An exciting opportunity for the position of Accounts Officer - Debtors has arisen for a suitably qualified and experienced person at Allied Timbers Zimbabwe (Pvt) Ltd. Allied Timbers Zimbabwe (Pvt) Ltd is an extensive, local and international provider of high quality and durable timber-based solutions for both industrial, domestic and"
Finance and Administration Assistant - Maternity Cover,Trcaire,Harare,Expires 15 Aug 2025,About Trcaire Trcaire is an International NGO. We work with local partners in the world's most at-risk communities and with people in Ireland to tackle the underlying causes of poverty and injustice and respond to the crises they create. Together we bring about positive and lasting change for a just
Supply Chain Officer - ReAdvert,Green Feathers Farm Pvt Ltd,Wedza or Hwedza,Expires 15 Aug 2025,"WHO WE ARE: We are a diversified agricultural business located in the heart of Wedza district, just 120 km southeast of Harare. Our main pillars of production are horticulture, cereals & tobacco, livestock and agro tourism. WHO WE ARE LOOKING FOR: As we continue to grow, we seek talented and"
Student's Attachment,Green Feathers Farm Pvt Ltd,Wedza or Hwedza,Expires 15 Aug 2025,"WHO WE ARE: We are a diversified agro-based business, situated 120 km South East of Harare. We specialise in sustainable crop production, livestock farming, beneficiation, and agro-tourism. AGRICULTURE STUDENTS' ATTACHMENT Students studying towards the following programs are encouraged to apply:  Degree in Crop Science or Equivalent  Degree in"
Student Attachee,NATIONAL EMPLOYMENT COUNCIL FOR THE CATERING INDUSTRY IN ZIMBABWE,Harare,Expires 15 Aug 2025,STUDENT ON ATTACHMENT
Marketing Officer (Infinite Bloom),Traverze Travel,Harare,Expires 15 Aug 2025,"We are a vibrant and growing floral business specializing in fresh cut flowers (Infinite Bloom), floral arrangements, and event floral dcor. Our mission is to bring beauty, creativity, and joy into every space with flowers. We are currently seeking a dynamic and creative Marketing Officer to join our team and"
Community Development Volunteer,SOS Children's Villages Zimbabwe,Shamva,Expires 15 Aug 2025,"COMMUNITY DEVELOPMENT VOLUNTEER (Job Ref: FSPB/04/08/25) Working location:  Shamva Supervisor:  Field Officer Context of the position Established in 1949, SOS Children's Villages International (CVI) is a dynamic, international social development organization working globally to meet the needs and protect the interests and rights of children without parental care"
Pharmacy Technician,Ponai Medical Centre - Avondale Urgent Care Clinic,Bindura,Expires 14 Aug 2025,Ponai Medical Centre is inviting applications from suitably qualified candidates for the post of Pharmacy Technician at our Bindura Branch.
Pharmacist,Ponai Medical Centre - Avondale Urgent Care Clinic,Bindura,Expires 14 Aug 2025,"Applications are invited from competent suitably qualified and experienced persons to fill in the position based Bindura,"
Call for a Consultant to Develop a Community based Mental Health Training manual for Wild4Life program,Pangaea Zimbabwe Aids Trust. PZAT,Harare,Expires 14 Aug 2025,"Introduction and background Pangaea Zimbabwe (PZ) is a registered local Private Voluntary Organization (PVO 10/20) that envisions a world in which all human beings live healthy, productive, and quality lives. PZ strives to transform the lives of underserved populations by working to increase access to quality, responsive, evidence-based, client-centered comprehensive"
Pharmacy Technician,Ponai Medical Centre - Avondale Urgent Care Clinic,Bindura,Expires 14 Aug 2025,Ponai Medical Centre is inviting applications from suitably qualified candidates for the post of Pharmacy Technician at our Bindura Branch.
Seeking Local Supplier Partners for NGO & Multilateral Tender Opportunities,N/A,Harare,Expires 13 Aug 2025,"We are a Zimbabwe-based consultancy that specializes in helping companies secure tenders and consulting contracts with NGOs and Multilateral Institutions. Our core strength lies in navigating complex procurement processes, developing winning proposals, and ensuring compliance with donor requirements. We are now looking to partner with local, Zimbabwean-owned companies that want"
Investigations Officer,Agricultural Finance Company Holdings (AFC),Harare,Expires 13 Aug 2025,"INVESTIGATIONS OFFICER ROLE PROFILE Reporting to the Audit Manager, the Investigations Officer will be responsible for investigating incidents of misconduct by internal and external members, as well as anomalies identified by Bank Management."
